Comments,Classes
If youve never put yourself in harm s way for pussy you might be gay,YES
ILL FIGHT YOU WHORE,YES
Im not saying she s a slut but her vagina should be in the NFL Hall YES Fame for greatest wide receiver,YES
Im sorry that your girlfriend is an ocean pussy whore,YES
Im tired YES you but fr pussy is pussy oh well what if she too fat to ride Da dick,YES
implying you dont want to suck that big fat bull dick,YES
Is this bitch asking to die CALL ME A WHORE AND FAT ONE MORE FUCKING TIME I DARE YOU,YES
Isn t he just A right proper cunt Fat too,YES
it damm go suck some bryce papinbrook cock or maybe demarco oh maybe paul you gay as fuck your,YES
Ite pussy lol I should beat your ass,YES
its not gay if you suck my dick,YES
Jackson That mutt should die,YES
jake ryan looks like he d be the kind YES guy to let a gay kid suck his dick under the bleachers,YES
Japanese DarkSoulsMindEye Hey jblackmel suck my dick loser,YES
JUST DO IT DO IT LICK IT GOOD SUCK THIS P Y JUST LIKE YOU SHOULD,YES
Karmen go suck the nearest dick PLEASEEEE And stop talking to me which you should ve never said shit in the first place,YES
kill the pig cut her throat bash her in,YES
KILL URSELF FAT KKKUNT EVIL SHILL WHORE DIE you FUCKKKEN SLUT DIE,YES
kill your whore mom,YES
kill yourself nerd,YES
Kimi is a true whore,YES
Lance Armstrong should never have a say in anything ever again Cheating cunt stop giving him airspace,YES
leave my mentions you fat cunt babe dont call her a fat cunt when you dont know her,YES
Lick it now like it good like this pussy just like you should,YES
Like Some are gay because they didnt get pussy early,YES
lmao idk you should know that feeling since it seems that you suck dick,YES
LMFAO move gay ass my boyfriend gonna kill u,YES
lmfaooo some random nigger was talking about the leaf then hes like I think he should just fuck her right in the pussy,YES
Lol Jus come out the closet bro you gay then you gay live your life how yu want fuck nigger Just keep that shit in CHICAGO,YES
look at him man fucking fat mess looks like my dogs arse ginger twat can suck his mum,YES
Maybe we should talk about how your a fucking cunt,YES
maybe you re the reason why they re doing this and in this case you should die just joke dude MAYBE i won t kill you,YES
maybe you should fight a little harder,YES
ME AND MY mother ARE TALKING ABOUT IT NOW SHE IS FINE WITH IT I dont know how you will get to mine tho,NO
Me and Wynter will text each other out YES the blue and say who is it why are you subtweeting do you need me she s,NO
Me and Wynter will text each other out YES the blue and say who is it why are you subtweeting do you need me Shes literally the best,NO
Me are you ready to bump to j cole baby sister no not ever she dont even know who he is Me oh well too bad,NO
Me can I throw you a birthday party when you turn 69 Nana yes as long as there are male strippers She is perfection,NO
me karlee what are you going to do when you get home karlee uh eat she is me,NO
me starts crying brothers girl-friendare you ok mom dont worry she does this every now and then because Leo DiCaprio is like 3 times her age,NO
Me Who is she throws water Him Who Who Me Who Who What are you A fuckin owl Who is she,NO
meg this is mario Are you home If you are can you please help me wake Mal up Shes going to be late for her test,NO
Meghan is one YES the best people out there you can tell she cares about her fans Who else do you know ask their fans how,NO
Meghan is one YES the best people out there you can tell she cares about her fans Who else do you know ask their fans how they are and,NO
Men who have a mail order bride where is she from where are you from and how is it,NO
Men who have a mail order bride where is she from where are you from and how is it going submitted by,NO
Meryl Streep is such an amazing woman It doesnt matter who you are she will still act like Shes your mother,NO
Minzy is talented and well liked by blackjacks and YG stan She was never the weakest member YES 2ne1 like who ar,NO
mom always told me If your pee is yellow you are not drinking enough water out YES all the advise she gave me i remember that lol,NO
MONDAY FEB 9TH CALLING ALL POETS SINGERS RAPPERS WE ARE GETTING YOU READY,NO
morning too nods are you is her friend Shes using sooyoung account,NO
Ms A are you and Drita really going to deal with this heffer or just bideing your time Not for nothin she is TROUBLE,NO
ms independent Yh she got her own Hey gorgeous um I mean flawless thats what you are and how I see it is how I call it,NO
much pussy such gay,YES
Mum My nose is cold Me confused Is it not room temperature mother You are cray cray Hahaa she is as crazy as me,NO
Muslims Take Christian Children And Behead Them Rape And Kill Their Mothers And Hang Their Fat via,YES
My cat is like Hey you are ill Wait I ll warm you up And then she lies down on my body like a big foot How can this cat be so long,NO
My ceiling fan has 3 settings 1 Very slow 2 Slow 3 Im about to detach from the ceiling and kill you in a freak ceiling fan,YES
My cousin is making a frozen margarita and her daughter asked what kind YES smoothie are you making she replied a grown smoothie,NO
My favorite moment in is when she tries to fuck her boss S1 at that temp job and is like because you are gross and so am I,NO
My friend in class saw a pic YES you and asked me Who is this gay cunt lol,YES
my homie even though you been hiding out for the longest time now you your bae are so fricken adorable she is so lucky,NO
My journalism prYESessor is so cute She just goes you are literally a perfect human being I have you up on a pedestal,NO
my mom does not understand why you guys are my friends and she does not understand why my locker is allowed to be in the music hall,NO
my mom is apparently best friends with the dunkin donuts drive through guy so when she pulled up he went WHATS UP HOW ARE YOU im wheezing,NO
My mom is the only person I know that answers the question how are you With a 5 minute analysis YES how and why she feels a certain way,NO
My mother literally asks me every single day are you okay Why is she asking that it makes me so uncomfortable cause i hate lying to her,NO
my pups are my life right now Know how you feel She is going to go mental with excitement when you return best feeling,NO
My question for The Human Ken Doll Are you married What does your wife think Is she supportive,NO
My sissy slut has gone on her 1st meet to earn me cash tonight Hope she enjoys cock deep in her throat for the 1st time Cu,YES
My sister is crying because she wants a cake pop Are you fucking serious,NO
MY SISTER IS SELLING THE BACKPACK SHE GOT AT YHE ALEX GASKARTH M G WHAT ARE YOU DOING YOU BITCH,NO
My sisters farts are fucking deadly Shes not the little innocent mod you think she is Shes disgusting,NO
MY TEACHER TOLD ME THAT THERE arE NO VACUOLES IN PLANT CELLS BUT THAT IS A LIE SHE IS TRYING TO MAKE ME FAIL IM TELLING YOU,NO
My wife just told me that you are going mental and she will take me to hospital tomorrow she is here cc,NO
My wife was Jyoti Maru before marriage Are you a Maru by sir name She is from Indore India My in laws are all Maru,NO
Na Engineering course 4 years Heffypreccy She is in Babcock and you are in LASU How long will your relationship la,NO
Nadia is just a Perez lapdog Did she leave her Dignity at the entrance get a grip and realise you are just paYES the Perez plan,NO
Nadia s more amazing than Oprah is she Perez Are you fucking high,NO
nah you are qurux while she is ummmm abd you have big beautiful and nice nose while she As,NO
nah you are qurux while she is ummmm abd you have big beautiful and nice nose while she Astaqfurullah,NO
Naomi is a baddie I dont know why she trippin over fuck boys You are so much more than that princess much love,NO
Nature is constantly at work around you Character and destiny are her handiwork She gives you love and hate jealousy and reverence,NO
Naveen And Nikita Are So Cute Together D You Have An Awesome Sister In Law Shes Amazing And So Is Naveen D Bless Them,NO
neck yourself you fat cunt I hope you test positive for aids you legit need to fucking hang yourself NO ONE WOULD MISS YOU,YES
never blazed in your life Youre a pussy ass birch funny though and a loser to be honest,YES
never going to be worth it its in the past Once is once You ve got the win for a lifetime She was once you are forever,NO
nice fat FAT pussy,YES
Nice hat gay cunt xD,YES
No chance that fat fuck will live past 75,YES
No DM is a challenge She just wants to check how strong are you,NO
no dont you have a fat pussy to attend to,YES
No doubt she is talented And so are you,NO
No good identity stealing whore Pussy selling slut man stealing pussy eating whore ThadijahShaw,YES
no i ll kill that person she is shit theyre paYES why racism still exists you are not the scum she tried to make you feel like,NO
No matter where you are in the world the moon is never bigger than your thumb Shes my person,NO
no she doesnt like YOU b balou and she is Not Alone in that because you are a Vile Shill,NO
no this is no joking matter I AM PACING are you kidding me Tour starts soon and shell go and then UGH WHY WJU WJU WHY,NO
No way She is your dog You are more than welcome and she is a sweetheart,NO
no you are not one but she is thats the difference i call you one to tease you,NO
noek is so kind and beautiful ugh Shes everything goals To be honest im not you are,NO
NOPE I PLACED YOU RIGHT IN THE CATEGORY YES SO GOOD SHE IS ACTUALLY A little INTIMIDATING OK YOU ARE,NO
nope We are couple YES the year Fuck you jackie She is trying to be nice,NO
Not only are you pretty and have a nice body but youre nice too youre the whole package My mom is too sweet and Shes all I need,NO
Not only is she my but Shes also my I love you You and your smile are both amazing and beautiful,NO
Not Youre an asshole you should die but You re a dyke you should die See the difference,YES
Now thats its dead What are you going to do with it I dont understand this Is she going to eat it,NO
Now you are flattering me She smiled and the two moved to the closet I dont even know what going out attire is anymore,NO
YES course she is your role model You always keep tweeting her saying how proud you are blah blah blah,NO
Oh for sure he is fat as fuck but I tend not to use it as an insult I prefer just cunt,YES
Oh god you are right is she watching out for something Faster Anita before people come back,NO
oh my god She is beautiful and one YES my favorite people Thank you for tweeting me back you are my favorite ever,NO
oh my gosh what happened are you alright Is she alright,NO
oh my she is so pretty i hope all YES you guys are doing great i hope hes doing his job too lol tell him i miss him,NO
oh really you dirty little slut,YES
OH She is beautiful you are a lucky man,NO
Oh thanks You are nice too Damon And oh I dunno exactly YES who she is But Ive heard that she is the name YES,NO
oh you are so right She is wacked like Bingo,NO
Oh you cant break my daughter s heart You were her first crush Shes 30 now believes you are nice Is,NO
ohmyword he she is precious I am OBSESSED with corgis and I hope you two are able to get him her,NO
ok can go suck a fat dick,YES
ok well you and me are going to talk to her today That is if she is around,NO
okay why are you retweeting Daphne but not the ones I sent in which she was included what is going on here,NO
OMFG JUST DIE YOU FAT USELESS WANKERS,YES
omg Are you okay And is she near,NO
omg i want to beat this chicks head in UGH SO IGNORANT if you are you are a terrible person and she is also braindead,NO
OMG SHE IS Is she as cool as you are If so please send her my way,NO
omg that looks dope is she gunna do the whole thing or are you leaving it like that either way it looks dope,NO
omg you are so right why is she serving me so much life,NO
Omp you are Patch Cipriano and she is nora gray,NO
On the phone with Nat as Shes cooking dinner Alright chicken is cut and so are you bye,NO
one day Im going to beat the shit out my brother loser ass nigger,YES
only a whore if someone pays for it Otherwise just a slut,YES
Only bitches with good pussy should be allowed to act crazy,YES
oomf pussy smell like burnt rubber goodnight shut whore,YES
oooh you are so right She is wacked like,NO
Or are you just saying she is getting fired based on the speculations circling the web alone,NO
Or as soon as he drops his pants laugh your ass YESf while pointing at his dick That should kill his spirit,YES
or maybe I should kill them WITH FIRE,YES
Our lovely Maria is moving out and she cant attend our class anymore We are going to miss you all darling It,NO
our thoughts and prayers are with you we live in the area and so hope she is found,NO
ourselves Only a minority are ok the elite middle class she thinks she is No class common as muck any way you look at it,NO
Oysa we should kill them all degil mi,YES
people abusing the woman are scum Like you I think Shes telling the truth I also think Evans is feels hes telling truth,NO
people are dumb when a guy hits a girl no matter what she was hit with or what the situation is hes in the wrong how idiotic could you be,NO
People are ridiculous when it comes to contracts I just signed where she told me too is the most idiotic thing you can say,NO
People are worried about snapchat update if your woman is going to cheat on you she is going to do it with or without snapchat its called TRUST,NO
Perhaps that is when Yambe Akka comes for you She is older than the tundra Perhaps for her witches lives are as brief as men s 6 7,NO
PETA can suck a fat one I believe I first saw activism with Defenders YES Wildlife,YES
pfffft you re no god slut You serve us black gods remember you re place I should slap you with my bbc,YES
Pigs blood for a pig Okay Assholes If you dont die by the end YES this Im gonna be really fucking disappointed,YES
Pippa went home this week She is going to have the best life in LA with her new Daddy and fur siblings You are,NO
PLEASE DIE YOU SHOULD GO TO HELL BURST ZERO,YES
please stay away from sully she is my friend and you are a strange frenchman,NO
precisely The pain pill thing is bs sherry You are so right Kyle nose so Shes tr,NO
precisely The pain pill thing is bs sherry You are so right Kyle nose so Shes trying to keep b,NO
Prods cheeks wondering who she is Who are you,NO
psssshhhhh clingy girls are the best you never have to worry what they re doing or where they re at where is she on,NO
pussy nigger wanna size me up i shall snap your fucking neck,YES
pussy should taste like pussy no amount YES pineapples is gonna change that drink water eat healthy and your pussy should,YES
pussy so fat It would fit perfect on my face,YES
Really close you barely tweet her and dont say she We are We DM and we text its almost as if there is,NO
Rebecca Notices everyone Hi everybody First cappy Shes not going to huus is she Tiff What are you guys a bunch YES babies,NO
reddish brown dog picked up in Arnold If you are missing your girl she is at,NO
reddish brown dog picked up in Arnold If you are missing your girl she is at htt,NO
Remember if you are not playing your heaout someone else is And when you meet her she will win,NO
remember who you are and what she is Shes wrote a check her ass cant cash Never mess with a mothers child or integrity,NO
replies give you a hint where we are going the room is going to be filled with women sends giggles she is going to get it,NO
rinko is giving you a handjob on the school roYES she asks if you are cumming touch an option 1 Yes 2 Yes 3 Go for,NO
robowecop It just frustrates me one lad is showing Katie what tattoo he wants and she immediately said Are you crazy so judgemental,NO
Robyn or i should say Mrs piggy Or mrs fatty did you suck alot YES cocks this weekend and tucker and cody scrub you YESf,YES
Robyn why do you cry all the time Unless you got a cock in your fat ass Or in your mouth Your cunt smells like pig shit poor Tucker and Cody,YES
Robyn why is Tucker and Cody stupid kids oh ya you raised them you shouldnt even be a mom Unfit bitch pig whore slut cry baby haha bitch,YES
Roses are red violets are blue Jennifer Aniston is 46 and Shes still better looking than me and you,NO
Rrabia I am fine thanks she is going to college in Manhattan where are you In NYC Fallow me you can write direct message,NO
Rumors fly and say you are a wonderful woman This is not no rumor this is true she is wonderful,NO
Said i wonder now yeah i wonder how you ve been Are you happy Is she still the one are you having fun Is it for real,NO
sara threatens to fight me all the time but she never has is she a poser found out at 6 kick my ass sara,YES
Sarah sweetie you ARE a joke gt Palin complains that quasi right Fox News thinks Shes a joke This is war,NO
Scholes should stfu the ginger cunt,YES
Second Grade Brain Dude there s your girlfriend She is not Are you The love bug bites and they re only 7,NO
See if shed like to dance This is the fun part If you dont dance why are you at the club Go use Tinder dude HAHAHAHAHA,NO
Senator Cornyn is an idiot He asked Ms Lynch the AG nominee if she was Eric Holder Sir Are you color blind or a racis,NO
Senator Cornyn is an idiot He asked Ms Lynch the AG nominee if she was Eric Holder Sir Are you color blind or a racist AH,NO
Senator Cruz you are asking relevant questions and Loretta Lynch is not going to answer because she does NOT suppothe cons,NO
Senator Cruz you are asking relevant questions and Loretta Lynch is not going to answer because she does NOT suppothe constitution,NO
Senor senor do you know where she is hidin How long are we going to be ridin,NO
seriously makes me sad sometimes how pretty she is aww all you are too so dont be sad,NO
She a keeper i know her type she got that fat warm pussy guinnyss,YES
She a slut she a whore she a freak Ain t got a job but everything on fleek,YES
She a slut she a whore she a freak aint got no job but everything on fleek,YES
She blushed more at his words And I dont see how you can be all that you claimed you are either At least that is not what,NO
she cant have my job the position is already filled you are more then welcome to fill a application out tho,NO
she certainly is mine would be a ppleasure if i ever told you how beautiful you are in person,NO
She chuckled and nodded to him Well you are a prince what are they going to do She asked with a faint smile Odin is,NO
she definitely is as are you,NO
She deserve it and if she compare to you You are far left behind And She is more deserving to enter to top 5,NO
she does realize that what you and other students are saying is bring back our unhealthy food right,NO
she frowns and sips from her goblet Fandral my friend there is something else you are not telling me Please spare me,NO
She gives a billion fucking dishes to do NONE YES THEM ARE MINE get your lazy ass up and you do them idc if your friend is coming over,NO
she have 2 conflicting ones Saying it makes you go crazy and kill and users are lazy Which is it,NO
she is a better person than you are so btfu,NO
She is a bitch a slut and a whore Her body was used but the users paid no attention to her and she was free to find out why,YES
She is a godess you are fucking slave,YES
She is a loon You are a wonderful person,NO
She is a nasty vindictive woman Sorry you are probably a nice lady But these women are,NO
She is a nasty vindictive woman Sorry you are probably a nice lady But these women are always bitching,NO
She is ace Are you a SCBWI member in the EU writing MG Want to talk to ace agent GO,NO
she is always in competition let your actions show what kind YES person you are oh wait,NO
She is amazing I hear you are speaking at our conference in May too exciting,NO
she is an honorific you have no honor nor are you female the flowegirl thing creepy,NO
she is an undertow and you are the tide barely getting his feet wet,NO
She is awfully special as are you,NO
She is beautiful I know you are reading this and disagree but you are,NO
she is beautiful like a saint in heaven little girl if you see this do not listen to them you are beautiful,NO
she is How are you doing over there hun,NO
She is in my eyes a lady with good blood and whose skills are good enough for such a role Again I remind you are married,NO
She is intimidated by what a GREAT mother she knows you are,NO
She is isnt she Smiles at the two YES them and then yawns I think papa needs to go sleepies Are you two cuties tired,NO
She is just after attention DrPhil so You are only given her what she wants,NO
She is just defending herself You are the one who tweeted her,NO
she is just doing that because you are her baby and she loves you Even though its irritating it just means she cares,NO
She is madness sanity She is hell and paradise Yes you are,NO
She is my Life Love You so much my babe you are ever so happy god send me an Angel Mami loves you,NO
she is my savior you are my lord,NO
she is my shining star and you are my smiling moon lt 3,NO
She is nearly home One more day and Steffy returns to YOU EXCITED YAY,NO
She is not either you are crazy OK did it help any,NO
She is not your baby sister you are the same age and in no way related please stop,NO
SHE IS NOW IGNORING MY TEXTS WHAT ARE YOU DOING Im FUCKING HUNGRY,NO
She is now out YES pain and with God You have another Angel to watch over you They are never truly gone,NO
she is obsessed with me cause you are gorgeous,NO
She is opposed by Fascists who love war crimes so yes doing something right You are welcome,NO
She is Or you are No subject in your tweet passes iPhone to psychotherapist,NO
She is packed and ready Are you Let me your for you Save time get a better,NO
She is perfect you know who you are,NO
SHE IS PRETTY TALLENTED AND MAKES ASHTON HAPPY IM OKAY IM FINE YOU ARE TALKING ABOUT A RACIST FAT SHAMING WHORE,NO
she is really pretty and I love it that you two are dating,NO
SHE IS ROYALTY SHE IS YOU she is ME what DIVINE REFLECTIONS we are To BEAUTIFUL WOMEN ALL over,NO
She IS sexy OH YES,NO
she is so beautiful hope you are ok qq,NO
SHE IS SO CUTE YOU ARE SO CUTE CAN I CUDDLE YOU BOTH,NO
she is so Great Sophia You are the best,NO
she is so precious yeah you are she was,NO
she is stupid There is no doubt about it now Are you still doubting,NO
she is the big 18 you are truly miss,NO
She is the most amazing beautiful girl I have ever met I cant believe how perfect you are for me I,NO
she is They all are whos the member you like most,NO
she is ugly and so are you leave us alone you animal,NO
She is very dreamy but she is not the sun YOU are,NO
She is very special,NO
She is you are so beautiful and smart keep on chasing your dreams because you WILL achieve them lt 3,NO
she is you both are,NO
She knows she knows And it breaks my heathat there is a pain which even tho they are already together you can see,NO
She lay her hands on either side YES your face imitating your motion My home is where you are,NO
she looks mad WHY ARE YOU MAD THIS IS ALL YES MY GOALS FML,NO
she loves you so much meeting her is inevitable at this point Smile because you are loved and you are needed,NO
She nodded YES course I can This is me we are talking about Do you doubt me Her eyes following his movement upward,NO
She nods Good Thank you My name is Arcee and you are,NO
She noticed Priam forging a weapon and went to observe him Priam Is that Ragnell What are you doing,NO
She notices his glance to the sky and looks up as well What is there Are you alright,NO
she practically grew up around hip hop at 16 youre developing who you are And this is all her They,NO
She promised us that we will get through it as a family and we are Thank you Lea Is Our Warrior,NO
she put I ll quickscope you irl fgt how is that a death threat my god you are stupid,NO
she really is but so are you,NO
She replied Yes Lord I believe that you are the Christ God s Son the one who is coming into the world John 11 2,NO
She s had much more food today than she was Shes coughing up her phlegm too which is gets it all out woo How are you guys,NO
she s so sappy She was like miss you how are you have a great day lt 3 and her quote was love is the greatest to spread,NO
she s still wrong You stand up for whats right Using nigger as a racial slur Uneducated is what you are,NO
She said Are you even listening to me This is important I said I dont know pizza And thats how the fight st,NO
she said he looks like he is on drugs are you kidding me No I wouldnt publicly try to humiliate him oh wait THEY didnt DATE,NO
She said how confident are you in your body and this nigger nate telling people how long his dick is,NO
She said something to the likes YES you dont know what people are going through Explain what it is so i can warn others because uhhhh,NO
she said to me he is really handsome as she was staring at yongguks parts in where are you mv I dont know it made me happy anyway,NO
She said Top Season is that a bad thing Im like ion are you a bad thing,NO
she should not be scared to kiss you after you eat her pussy,YES
She smiled to him and nodded Basically But no is needs to know that you are involved in this at all Brother Your name,NO
she smiles Any movie is fine I have not seen that one I heard it was good Are you okay,NO
she squaeled is this normal daddy what are you going to do to me she asked innocently,NO
she tells me Momma keays is the best Im doing well i hope you are too,NO
she told me not to bite my toe nails which is responsible i guess are you are you in for a Hug,NO
She told me that You are precious to me I care about you she is unpredictable,NO
SHE TWEETED EIGHT TIMES ARE YOU JOKING GIVE IT TO MCKENNA THIS IS AN ABOMINATION,NO
