Comments,Classes
why is this a thing why are you a thing because she is my mom,NO
why Shes just a fat bitch that needs to die,YES
Why should I have to tolerate these bastards Why can I not kill them all with fire or blunt knives and spoons,YES
Why would she freak out I warn you though Brighton is trashy and there are a few druggies,NO
why you dont fuck with me noww fat pussy,YES
Wink pussy,YES
withloveandrea is definitely a Mom I Would Love to Flaunt she is such a fashionista If you are sexy,NO
woman when are you going to learn that as long as she is your mom you have to ask her for everything for as long as you live,NO
Women are like blunts if you lick her right she wont run this is the greatest tweet Ive ever read,NO
women need constant reassurance that she is loved You are loved,NO
wow are you calling Laura Bush a pig Is it because she killed someone,NO
Wow she is my weakness You are so beautiful thanks love,NO
Wow this is your character s daughter and you tried to rp smut when Shes feeling vulnerable Wow what a decent human being you are Kudos,NO
wow what a n00b you should fight me in the wildy and then throw your computer out the window,YES
wow you shit cunts go die and get ebola FUCK FIFA your GAY LORDS your JUST FINGERING EACHOTHERS BUTS,YES
Ya mamma should have swallowed yo pussy ass,YES
YASSSS Miss Brucine Jenner She is fierce Why are why all mad I cant deal with you,NO
Yay Im so happy She is only 4 months old too You are like the only female YTer I watch so D,NO
yea I feel you A LOT YES headcanons are kinda weird I mean I love her but I know she is guardian I just try to make,NO
yea it is Im tired too and so are you Shes just doing her job for Christ s sake,NO
yeah and if she is then why are you even with her lol,NO
yeah are you on STM someone would knock her teeth out if she came knocking on their door not nice,NO
yeah are you on STM someone would knock her teeth out if she came knocking on their door not nice is it,NO
yeah bitch i dont want your fat stomatch on my mention i am not cameron i am Agung fight her,YES
yeah she is right Are you going to be in Vienna tomorrow lt 3 from Austria as well p,NO
Yes it is I dont think I can help him She sighs sorry I shouldn t be worrying about it so how are you,NO
Yes she does You should see her pussy Immaculate,YES
yes she is and are you ok now,NO
yes she is are you joining,NO
YES She is in freaking COURT why are you asking about her clothes,NO
Yes She was Just like Zedd is now in your fanbase and you all are responding to the way she is treating her,NO
yes Think try to be neutral but you know she is proud Serena Venus are from my town Live 5 miles away,NO
Yes yes I know I know But now you are back Oh David She is crying a lot still hugging him very tightly,NO
Yes you are dont say she is ugly she is not,NO
Yet my roommate is certain she isnt a hipster Even pandora knows that you are its cool I u,NO
Yo are you putting KenZ mom in the wank bank tonight if she is a milf,NO
YO PUSSY GAY,YES
You all really hype up Bowser because she apparently got a fat ass meanwhile her pussy come with the stomach flu,YES
you all should be afraid YES what Im gone do next,YES
You always know a girl is going to talk shit about someone to you when she starts out saying so how good YES friends with are you,NO
You and are friendship goals as fuck Awwwww thank you a lot she is mah cutie pie i love her so freakin,NO
You and your friends are Jem girls Jem Jem is her name Shes outrageous Truly truly truly outrageous Wit,NO
You and your friends are Jem girls Jem Jem is her name Shes outrageous Truly truly truly outrageous With a hot tub car,NO
you and your girl are meant to be She knows who she is,NO
you are 19 she is 14 but you wont me tho,NO
You are a big boy Si It might be a bit difficult no matter how strong she is,NO
You are a fool I thought Angie Stone was doing good Why is she on,NO
you are a garden rose and all she is a dandelion a weed,NO
YOU ARE A GROUPIE ASS nigger LMAOOO is even tho she wont talk to me,NO
you are a horrible sexist and coward person That response shows how awesome she is but the q shows what an asshole you are,NO
you are a LIAR My mom is japanese she never heard YES eating dolphin meat You should be ashamed YES urself,NO
you are a liar we know you worship hillery clinton she is a socalist lying scum bag like yourself,NO
You are a moron We just think Anita is a lying con artist She also insults us So we do not like her,YES
You are all blue and everything is pink I feel so happy I want whatever she is having P,NO
you are also like 16 and she is 28 or something i believe in you,NO
you are an amazing She is happy she wants a party to celebrate and you all think what Get over it its over,NO
You are back you are back She is crying a lot but also smiling widely I lost you you left me but now oh now,NO
You are beautiful she is beautiful cant that just be it,NO
You are better YESf hun she is just a bitter sad woman,NO
you are blind so shed DM as in so she would DM god is english your second language or,NO
You are both rockstars with at she is a rockstar,NO
you are both welcome Weird saying she since she is in the convo,NO
you are dumb ass fuck my mom worked realstate in 03 she is a nurse nowand that is not my house and you known that,NO
you are hanging out with a girl dating SO FUCKING WHAT She is gorgeous and youre happy Fuck the haters,NO
you are incorrect She is pure,NO
you are jealous from everything I do your condition is very serious you should go and see a doctor or you will die because YES me,YES
you are just awesome is just awesome,NO
YOU ARE ME AND I AM YOU LOOK SHE IS HIM AND HE IS HER AND SHE IS YOU AND YOU ARE HIM,NO
you are my bro but my true love is bus She get my engine revving htt,NO
You are my second favourite guest Joy Hinchcliffe is my favourite she could kill us all,NO
You are no better than she is so dont even bother,NO
You are not a directioner but you are a fan YES Sophia Im not her fan because she is just a normal girl I,NO
You are not alone on that island I hate the romance will she wont she stuff too But it is CW so,NO
you are not capable YES any thing Hustle your way to your grave Cunt Pathetic loser,YES
you are not helping my cause do you understand what she is asking YES us on her website homepage,NO
You are not here She is angry and has a Princess Dress and Crown on and she denies she even knows her dad,NO
you are one fat smelly ugly cunt,YES
you are oprah she is you,NO
you are purrtyyyyy baby she is too sweet to me,NO
You are right about Nancy She is very real and vulnerable,NO
You are right Beyonce is pretty useless and isnt even hot Plus Shes from the armpit YES Texas Houston,NO
You are right Matt its Rachel she is so pretty,NO
you are right She is a misfit only time will unravel it It will damage the party in long run,NO
you are right to she is alive and well in the form YES Selena Gomez,NO
You are so big time is big time,NO
You are so right Made 10 out YES 20 My Granddaughter can do that good and she is 7 lol,NO
You are terrified to let her go but you are afraid she is to good for you that she could drive you wild,NO
you are the best exposed now we know why she is shying from debate,NO
You are the cutest YES all She is Cute,NO
You are the ice and she is sliding on it says guest maestro Edward Parmentier to our bassist,NO
YOU are the one that said she is bad at singing not me I said se sings a lot,NO
you are too but fs she is the most para person I know,NO
you are too cool for her horseshit She doesnt want help Her addiction is attention,NO
you are too wild in the tub with She is old enough to be your momma,NO
You are totally going to own that fun fact she is the only woman who hunted with the Yajuta and lived among them on their ship,NO
You are welcome and yes I do My mom is a cancer survivor It has been 22 years now We are blessed that she is still with us,NO
YOU ARE WELCOME EONNIE IS SHE AN ELF TOO LOL ANYWAYS YAYYY I HAVE A NEW EONNIE COS MOST YES THE TIME I AM THE EONNIE HAHAHA,NO
you are welcome Hope she is ok,NO
you big fat handicapped cunt,YES
you boring fat cunt please hurry up and die,YES
you boring fat cunt please hurry up and die,YES
you can go suck a fat one lol,YES
You can order here out Sue She is looking fabulous Sue says Are you,NO
You can tell a lot about a woman from her hands for instance if they are firmly around your throat she is probably sli,NO
You can tell a lot about a woman from her hands for instance if they are firmly around your throat she is probably slightly,NO
you cant laugh you fat cunt,YES
you cant read what I tweeted I said she s a whore which means bitch know your English oh I forgot you dont understand cunt,YES
You certainly are a hypocrite THAT is abundantly clear She is cute the lyrics YES group are hate filled gt lt,NO
you dont look scared but you should be afraid,YES
You eat more pussy den me Girl you shouldve been uh nigger,YES
you fat cunt,YES
You going to lick this pussy just like you should,YES
you guys are weird she is joy to the world all the boys and girls ha finally placed that,NO
You have literally ruined bashurs life You should seriously fucking kill yourself you re the teal child molester,YES
you have this fan who is really pressed for you You gotta step to her expectation dude She seems to think you are lacking,NO
You know a date is going poorly when she says we are just friends right,NO
You know in Grey s Anatomy were Christina and Meredith are always like Shes my person well Bryanna is my person and i love her man,NO
You know she ain t into you for shit when she is on the phone half YES the time when you are talking,NO
You know she is the bestest YES best friends when she YESfers to walk to your house and get you chocolate because you are ill,NO
You know what is fucked up is they are going to live forever but she is only going to love him for 2000 years,NO
You know what Oil prices are shot right now Plus my meat is as black as they come Let have it Shes a pro,NO
You know you are old when you want to thank for all her help She is just so smart,NO
You know your life is sad when you are elated when your mother says she will let you get a bouncy castle for your 18th,NO
You people should just die,YES
You re a bitch cunt whore Bless Madonna,YES
You re a loser So go ahead and live your loser life make a bunch YES loser friends Then together you can lick each other s loser wounds,YES
you re just the right amount YES fat and i ll definitely treat you like the slut you are,YES
You re right calves are amazing This is Ricki SHE is such a sweetie loves to be petted,NO
you re such a stupid cunt Die You re better dead than alive You should be in an elderly home Being abused,YES
you right now you fat ugly cunt,YES
you say me first that i am pretty and i believe naow you say that the bich is pretty and you are boy-friend YES she,NO
You see there with Brandi bringing up the fact all these girls are actresses its like she wants to be one Or is obsessed with TV,NO
you should all die,YES
You should be able to fight soon right,YES
You should be in bed you slut,YES
You Should Die,YES
You should die all together,YES
you should die for that,YES
you should die now Haru,YES
you should get me one because I cant ever meet them but what the hell is her problem She was a JCAT and then left cause uj are,NO
you should kill yourself dad,YES
YOU SHOULD PROBABLY KILL YOURSELF,YES
You should really consider working on your people skills Im fine with people you re just a cunt,YES
You should Suck My Dick How about that one,YES
You should thank me for the honour YES letting you watch me fill your hot wife tight cunt snow bunny bbc owned,YES
you should totally tweet her she is literally LOVES you We are also planning to kidnap you and Riker,NO
you should ve beat him lmao I told you too,YES
You shouldn t be pissed at me for my 3 inch dick you should be pissed at the big ass pussy you got,YES
you shouldn t say that She is trying to sparkle and you are bringing down her shimmer,NO
you suck,YES
you suck fat chicken cock,YES
you suck fat dick that s why,YES
you sure you are okay Im fine My sprain is nearly gone She is very good thanks sweetie,NO
You too are a special person to me I hope someday to meet her she to meet my friends is very sweet,NO
you wanted him out last week you fickle cunt make that mind up you fat cunt,YES
You were getting fingered and eaten out at 12 lmfao by a 17 year old Ahaha you should be ashamed YES yourself nasty little slut lmao,YES
you would swear she went on a week bender Is this not meant to be realistic people are going t,NO
you would swear she went on a week bender Is this not meant to be realistic people are going to drink,NO
Young Pretty Indian Whore Loves To Suck And Fuck,YES
your a gay cunt Mikee,YES
Your daughter is not a special snowflake she is a lazy little madam and you are enabling her Stop it right now,NO
your daughter should go choke on a dick and die,YES
Your girlfriend is going to cum when she sees you thats my cousin why all,NO
Your little girl is going to be wise with a mom like you Shes going to be so proud when she realises how strong you are,NO
your welcome You are studying with garland she told me that she is studying french too,NO
Your wife is half your Deen half YES you half YES your Islam You are not complete without her So treat her as the Quee,NO
Youre so afraid YES being called gay Got a secret kid,YES
Zach or whatever their names are No she was just out YES focus And why do you think that is idiot,NO
Many People still Blame you according to their mind...But Never stop being a good person.Thanks Mark Zuckerberg!,NO
Adding on,NO
Are you working Sir?,NO
Why is this so hated I like it the video is a little cringy but I still like it xD @@@,YES
I came here to dislike @@@,YES
WOAH WOW @@@,NO
O meu Deus @@@,NO
her voice sounds like offbrand kesha @@@,NO
Warum so viele daumen runder das lied ist richtig geil  why so many thumps round the song is really cool @@@,NO
wtff @@@,NO
This song is actually about the assassination of JFK @@@,YES
Me the song is actually goo Another me slaps me Me rethinks life decisions @@@,YES
Still listening in 2018 @@@,NO
Why is this so much hated  @@@,YES
Best @@@,NO
She tried to make it like Ke$ha's Tik Tok but made it a disaster @@@,NO
Autotune detected @@@,NO
S eu de brasileiro aquiii @@@,NO
This is trash @@@,YES
Love this song @@@,NO
What's with her voice @@@,NO
who was the guy rapping in it @@@,NO
Ew @@@,NO
killing myself now @@@,YES
Your video made my friend write the lyrics in cursive @@@,NO
Is this song a joke @@@,NO
no one likes this song @@@,NO
Rebecca make a better vid next time @@@,NO
Likers are people who either are big fans of Rebecca black or just enjoy someone constantly Talking about fun and Friday @@@,NO
bruh this song is cringe as HELL @@@,YES
3.1 MILLION @@@,NO
she thought this song would be famous but nope @@@,NO
Its friday Me its monday @@@,NO
This makes no sense she says shes going on the bus but shes going in a car @@@,NO
No fao ideia de como vim parar aqui Mas a zoeira no pode morrer nunca @@@,NO
I wonder why I defended this song it is so bad  But looking back on all the hate it got it is not the worst song granted not a good song by any means but now there are WAY worse songs out there @@@,YES
great like to dislike ratio @@@,NO
gotta hate it @@@,YES
AAAAAAAAAAAAAAAAAAAAAAAAGH THIS HAS BEEN IN MY HEAD FOR 4 DAYS HELP MEEEEEEEEEEEEEEEEEEEEEEEEEEEEEEEEEEEEE @@@,NO
Worst song ever @@@,NO
I LOST BRAIN CELLS HELLLPPPPPP LIL PUMP SAYING GUCCI GANG IS BETTER THAN THIS SHIT @@@,YES
Rebecca Black The song is called Friday It kinda looks like the song is called Black Friday @@@,NO
I wonder how much these back dancer people were payed to listen to this @@@,NO
Fuck you Rebecca Bcuz you are black @@@,YES
Call of duty infanate warfare commpetor @@@,NO
That acne @@@,NO
2018 @@@,NO
Lets not Dislike Rebecca She is a nice girl @@@,NO
So many friday @@@,NO
I thought that shes waiting for a bus What happend to that scean @@@,NO
So thats why Hannah Baker did suicide @@@,YES
Only one word Cancer @@@,NO
Before my birthday with a day Oof @@@,NO
Cancerous song @@@,NO
Her Friday was really do piercing on the ears @@@,NO
Dame daniel the amount of dislikes though @@@,NO
Someone plz calm the ambulance I had a stroke when this song stated singing @@@,NO
Pewdiepie's video has more dislikes than this @@@,NO
Alguem de 2019 @@@,NO
Is it me or does the boy who's driving look about 12 or 13 @@@,NO
6 years ago That makes sense why it's shit @@@,YES
makes you feel like wanna put a hot coal down her throat and brush it off deeper @@@,NO
still until today we still hate your voice @@@,YES
Worst song ever  @@@,NO
What the fuck kill me @@@,YES
just seen her in the papers she looks fit @@@,NO
Cool 0 @@@,NO
That black guy is banging middle schoolers @@@,NO
I thought my brother was retarded then I saw this and hes smart compared to this bloody rubbish @@@,YES
I love it  @@@,NO
2018  @@@,NO
kevin kael Yep @@@,NO
when haces tu momo en el vdeo mas odiado de youtube v @@@,NO
Yeah Friday the 13th @@@,NO
I bet she is sarcastic about who enjoy the weekend @@@,NO
Why is there even likes I could get a heart attack or vomit but really I kinda feel like @@@,YES
THIS SONG SUCKS BUTT IT LITERALLY DOESNT RYME AND MAKES NO FREAKING SENSE @@@,YES
Clasic @@@,NO
This song should have been in the movie Friday with Ice Cube and Chris Tucker @@@,NO
What is more stupid that a stupid song Disliking it like mad @@@,YES
This is a good song I love it screw the haters @@@,NO
Honestly I dont get the point of this song @@@,NO
Fridayyyyy hahahaha GOATZZZ @@@,NO
Wtf is this this I more wort than Minecraft @@@,YES
Only 121 million views That seems too low @@@,NO
I can't even with her voice @@@,NO
umm today is monday @@@,NO
Who watched this shit on June 4 2018 @@@,NO
June 5th @@@,NO
2018 and people still dislike her LOL @@@,NO
"Yesterday was Thursday""-Really @@@",NO
I cant believe how much her voice has changed lol @@@,NO
I would rather vote for Donald rather than this @@@,NO
This is the spread for cancer @@@,YES
I just love the fact that there are 3 million dislikes @@@,NO
More dislikes than likes lmao @@@,NO
white people music @@@,NO
I hate this song @@@,YES
HINO  FRIDAYYYYY  FUCK @@@,YES
Shes so bad @@@,NO
3.1M dislikes sorry @@@,NO
816k likes 1.3M dislikes wow Humiliating but not surprising @@@,YES
i hate  @@@,YES
I totally forgot how trash this song was @@@,YES
My ears hurt after I heard this song @@@,NO
I dunno why it had so many dislikes and I think it got demonetized @@@,NO
When I first saw this I thought it was a joke @@@,NO
cringe is this 2010 or 2011 plus why you so like feeling good friday is a sad day for people now because of this boil crap dab on those haters @@@,YES
The 3rd grade me also hated this because my teacher used to play it loud and clear on Fridays @@@,NO
I cant tell which is worse this or Justin Bieber Baby @@@,NO
wtf is this @@@,YES
Omg yah the video might be really cheesy but y'all are being really mean and salty just STOP mabey she made this for some fun @@@,NO
I only just finished it after many attempts @@@,NO
best song ever @@@,NO
LOL @@@,NO
It's so bad how did it get so many views @@@,NO
Lyrics written by a nut less monkey @@@,NO
Yo slo vengo a dejar mi dislike Bay @@@,NO
Friday friday v xddd @@@,NO
Yesterday is Thursday Thursday today is Friday Friday Top 10 most insightful song lyrics of the century @@@,NO
Worst song ever @@@,NO
The guy in the backseat of the car @@@,NO
Ironic that the song Johnny One Note changes notes FAR more frequently than this song @@@,NO
Am I the only one who likes this song @@@,YES
This song has more dislikes than than views Edit wtf that isn't even possible @@@,YES
Amazing in it's level of banality and family friendly vapidness It's very bad @@@,NO
Are these kids old enough to drive @@@,NO
Am i the only one thinks she sings like Melissa Rauch @@@,NO
So I noticed this video is trash @@@,YES
FUN FUN FUN FUN @@@,NO
Kys that was in the video and who made it @@@,NO
I literally couldnt laugh anymore with those funny comments I had eye seizuresLMFAOOOO @@@,NO
This is cringy but I always laugh at this @@@,YES
WOW it is so BAD @@@,NO
I just came to this video to see the comments @@@,NO
Y am I listening to this on a Monday @@@,NO
Wth is this shit @@@,YES
Worst song ever @@@,YES
The cringe oh the horror @@@,YES
Please Stop My hangover is getting worse every second @@@,YES
Ahhhhhhhhhhhhhhhhhhhhhhhhhh @@@,NO
I have a crush on Rebecca.....she's so cute I know this song is cringy but she has done some amazing work @@@,YES
3.1 mill dislikes God damn @@@,NO
Feels like my ears got raped @@@,YES
its FRI RI RI DAY(GOATS SONGS @@@,NO
Friday,NO
Help me @@@,NO
This song is stupid @@@,YES
Bad green screen and the voice sounds like your voice is creaking @@@,YES
what a piece of shitxgoddamm @@@,YES
I was about to have a good week this ugly motherfucker ruined it @@@,YES
Fuck this shit I hope the producer gets cancer on his balls for that sick fuck This is not a music video This is AIDS in form of music @@@,YES
I know which seat the seat to hell your annyoing voice makes my ears bleed @@@,YES
my ears are bleeding @@@,YES
Everyone looking forward to 10 million dis @@@,NO
No entiendo nada @@@,NO
Kiddies always use condoms And drunk sex is rape @@@,YES
purple shep brought me here @@@,NO
Is it just me..or do others want the convertible to flip @@@,NO
FUN FUN FUN FUN @@@,NO
"iframe width=""854 height=""480 src=""https://www.youtube.com/embed/42kY-HaJe3o frameborder=""0 allow=""autoplay encrypted-media allowfullscreen></iframe>please rebecca black watch abakarir abakarir like your song friday and this video its abakarir parody @@@",NO
 @@@,NO
k sad xd @@@,NO
Nigga i played this and my baby on my wifes belly started crying @@@,NO
I mean the kick on this is pretty good except it repeats the same pattern @@@,NO
 @@@,NO
This really is a horrible song @@@,YES
my ears  it's terrible the girl clearly does not have a hearing and most importantly the voices She should at least learn to sing and then already shoot clips on YouTube She flashes too much auto tuning This disgustingly sounds @@@,YES
You'll get used to it @@@,NO
The real problem is green screen and and no rhymes LIKE C'MON @@@,NO
Now i hate Friday xD @@@,YES
I just came here to see the dislikes @@@,NO
Que fea la cancion @@@,NO
It does not rym @@@,NO
No me gusta la musica no me gusta el video @@@,NO
MY EYES @@@,NO
Lol look at the dislikes it has 2mill more then subs lol @@@,NO
I think I Ive hit the most lowest point in my life by watching this video @@@,NO
Was this a real song or a joke @@@,NO
If my opinion friday its my worst day in school and this song make me happy D fried day V @@@,NO
I think people think this is cringe That explains the dislikes @@@,YES
Its wednesday my dudes @@@,NO
So many disslikes 1 for me @@@,NO
 @@@,NO
Is this the most disliked video on youtube oh yha the only seat you can take is the one thats open @@@,NO
This video has way more dislikes than likes @@@,NO
partying partying yeaa...partying partying yeaa it's so cringe it's so cringe yea...it's so cringe it's so cringe yea @@@,YES
I just want to take my pants off and then just cum @@@,YES
Bad video @@@,NO
Braaaaa @@@,NO
I'm pretty sure this transmitted a tumour into my brain through sound waves @@@,YES
Well...Corey was right about this song @@@,NO
is going to fuck you dirty whore @@@,YES
Compare this to the great divide It's like comparing the dollar store not that bad but alot of fake-ness and target @@@,YES
2019 @@@,NO
I disliked @@@,NO
Landon Elsperman look the draw my life rabbeca and i say Stopp dislikeee @@@,NO
Shes really ugly and annoying @@@,YES
This is crazy @@@,NO
omg i so love this @@@,NO
this Video has more dislikes than likes @@@,NO
FUCKING Cringe @@@,YES
Hey those school kids were driving a luxurious car n moreover were partying in a club with beer n all Like are u serious @@@,NO
Really nigger @@@,NO
This has mor disslikes then likes and her subscribers @@@,NO
creo que me gusta rebeca @@@,NO
The lyrics is so weird today is friday yesterday was thirsday whay @@@,NO
Still crappy after 6 years lmao @@@,NO
like what @@@,NO
This is just so freaking awful  Just why @@@,NO
When you go back to kindergarten cause you're too stupid @@@,NO
Every night I kill mosquitos with this song  @@@,NO
0:53 best note in the song 3:47 of the song ever @@@,NO
Mnlight yeah @@@,NO
I got brain washed Too much dog crap @@@,YES
You all humiliated this girl like she didn't try at all What annoys the most is the followers that just see other people are doing it so they think they should do it also @@@,NO
TBH only the lyrics suck which makes the whole song a bit weird but its still better than nothing @@@,YES
This is Childhood Nightmares to me...Anyone else Ok nvm @@@,NO
This is complete dog shit @@@,YES
6 years of HATRED @@@,YES
They are all white @@@,NO
Lolololol @@@,NO
Glee Version better than this @@@,NO
I wouldn't even wipe the sheets of lyrics of this song with my ass @@@,NO
Just stop @@@,NO
W.......T........F @@@,YES
Who else came here to dislike @@@,NO
me @@@,NO
I've never understood why people hate this song so much it's kind of a good song actually @@@,NO
The dislike ratio Lmao @@@,NO
Trash is my brazil @@@,YES
Omg I can't it's so annoyinger in 2018 lol @@@,NO
Lo intento @@@,NO
uhhh you can sit in the back unless your friend got one of those cars that 3rd seat on the front so make your mind up rebecca @@@,NO
don't mind me i just came to leave my dislike @@@,NO
Don't forget to like all of my comments @@@,NO
